{
  "@timestamp": "2026-09-01T08:02:00.000Z",
  "message": "password=[REDACTED] ingestion failed",
  "ecs": {"version": "9.4.0"},
  "event": {
    "id": "evt_source_failed",
    "kind": "event",
    "category": ["file"],
    "type": ["error"],
    "action": "source-failed",
    "outcome": "failure",
    "severity": 3,
    "provider": "twin-kms",
    "module": "activity",
    "dataset": "twin.audit"
  },
  "service": {"name": "twin-test", "version": "1.2.0", "environment": "test"},
  "trace": {"id": null},
  "http": {
    "request": {"id": null, "method": null},
    "response": {"status_code": null}
  },
  "user": {"name": "system", "roles": ["operator"]},
  "twin": {
    "audit": {
      "schema_version": "1.0.0",
      "source": "activity",
      "source_event_kind": "source-failed",
      "severity_name": "error",
      "operation": null,
      "emitted_by": "server",
      "route_group": null
    },
    "auth": {"method": "system"},
    "resource": {
      "type": "document",
      "id": "doc-17",
      "name": "employee-handbook.pdf"
    },
    "folder": {"id": "hr"},
    "workspace": {"id": "default"},
    "data": {"classification": "C2", "retention_policy": "7y"}
  }
}
